{
  "version": 1,
  "profile_id": "repo-steam-3241660-build-23363152",
  "input": {
    "motion_aim_mode": "hybrid",
    "dominant_hand": "right",
    "handedness_swap": false,
    "actions": [
      {
        "id": "move_x",
        "binding": "left_thumbstick_x",
        "gamepad_binding": "left_stick_x",
        "gamepad_fallback": true,
        "dead_zone": 0.15
      },
      {
        "id": "move_y",
        "binding": "left_thumbstick_y",
        "gamepad_binding": "left_stick_y",
        "gamepad_fallback": true,
        "dead_zone": 0.15
      },
      {
        "id": "turn_x",
        "binding": "right_thumbstick_x",
        "gamepad_binding": "right_stick_x",
        "gamepad_fallback": true,
        "dead_zone": 0.2
      },
      {
        "id": "interact",
        "binding": "right_trigger",
        "gamepad_binding": "gamepad_a",
        "gamepad_fallback": true,
        "dead_zone": 0.05
      },
      {
        "id": "menu",
        "binding": "left_menu",
        "gamepad_binding": "gamepad_start",
        "gamepad_fallback": true,
        "dead_zone": 0.0
      },
      {
        "id": "recenter",
        "binding": "right_grip+left_grip",
        "gamepad_binding": "gamepad_back",
        "gamepad_fallback": true,
        "dead_zone": 0.0
      },
      {
        "id": "comfort_snap_turn",
        "binding": "right_thumbstick_x",
        "gamepad_binding": "right_stick_x",
        "gamepad_fallback": true,
        "dead_zone": 0.2
      },
      {
        "id": "comfort_vignette_toggle",
        "binding": "left_grip",
        "gamepad_binding": "gamepad_y",
        "gamepad_fallback": true,
        "dead_zone": 0.0
      }
    ]
  },
  "comfort": {
    "preset": "repo_safe_default",
    "snap_turn": {
      "enabled": true,
      "degrees": 30.0
    },
    "smooth_turn": {
      "enabled": false,
      "degrees_per_second": 90.0
    },
    "vignette": {
      "enabled": true,
      "strength": 0.55
    },
    "seated_standing": {
      "mode": "standing",
      "height_offset_m": 0.0
    },
    "world_scale": 1.0,
    "recenter": {
      "enabled": true
    }
  },
  "hud": {
    "coordinate_convention": "row_major_right_handed_meters_forward_negative_z",
    "anchors": [
      {
        "element_id": "HUDCanvas",
        "template_data": true,
        "anchor_mode": "head_locked",
        "visibility_rule": "always",
        "depth_m": 1.4,
        "scale": 1.0,
        "offset": {
          "x_m": 0.0,
          "y_m": -0.08,
          "z_m": 0.0
        },
        "curvature": 0.08
      },
      {
        "element_id": "HealthUI",
        "template_data": true,
        "anchor_mode": "head_locked",
        "visibility_rule": "when_gameplay",
        "depth_m": 1.35,
        "scale": 0.9,
        "offset": {
          "x_m": -0.32,
          "y_m": -0.22,
          "z_m": 0.0
        },
        "curvature": 0.05
      },
      {
        "element_id": "SemiUI",
        "template_data": true,
        "anchor_mode": "head_locked",
        "visibility_rule": "when_gameplay",
        "depth_m": 1.4,
        "scale": 0.95,
        "offset": {
          "x_m": 0.0,
          "y_m": -0.26,
          "z_m": 0.0
        },
        "curvature": 0.05
      },
      {
        "element_id": "ChatUI",
        "template_data": true,
        "anchor_mode": "head_locked",
        "visibility_rule": "when_menu",
        "depth_m": 1.6,
        "scale": 0.85,
        "offset": {
          "x_m": 0.28,
          "y_m": -0.16,
          "z_m": 0.0
        },
        "curvature": 0.05
      },
      {
        "element_id": "MapToolController",
        "template_data": true,
        "anchor_mode": "world_locked",
        "visibility_rule": "when_gameplay",
        "depth_m": 1.0,
        "scale": 0.75,
        "offset": {
          "x_m": 0.18,
          "y_m": -0.2,
          "z_m": -0.35
        },
        "curvature": 0.02
      }
    ]
  }
}
